<?xml version="1.0" encoding="UTF-8"?>
<arvosanat xmlns="http://www.example.org/arvosanat" xmlns:xsi="http://www.w3.org/2001/XMLSchema-instance" xsi:schemaLocation="http://www.example.org/arvosanat arvosanat.xsd ">
   <oppilas>
	<hetu>111111-111L</hetu>
	<tunniste>id</tunniste>
	
    <todistukset>
      <perusopetus>
        <valmistuminen>2001-01-01</valmistuminen>
        <AI>
        	<yleinen>5</yleinen>
        	<tyyppi></tyyppi>
		</AI>
		<A1>
        	<yleinen>5</yleinen>
        	<valinnainen>6</valinnainen>
        	<valinnainen>8</valinnainen>
        	<kieli></kieli>
		</A1>
		<B1>
        	<yleinen>5</yleinen>
        	<kieli></kieli>
		</B1>
		<MA>
        	<yleinen>5</yleinen>
        	<valinnainen>6</valinnainen>
        	<valinnainen>8</valinnainen>
		</MA>
		<KS>
			<yleinen>5</yleinen>
			<valinnainen>6</valinnainen>
		</KS>
		<KE>
			<yleinen>5</yleinen>
		</KE>
		<KU>
			<yleinen>5</yleinen>
		</KU>
		<KO>
			<yleinen>5</yleinen>
		</KO>
		<BI>
			<yleinen>5</yleinen>
		</BI>
		<MU>
			<yleinen>5</yleinen>
		</MU>
		<LI>
			<yleinen>5</yleinen>
		</LI>
		<HI>
			<yleinen>5</yleinen>
		</HI>
		<FY>
			<yleinen>5</yleinen>
		</FY>
		<YH>
			<yleinen>5</yleinen>
		</YH>
		<TE>
			<yleinen>5</yleinen>
		</TE>
		<KT>
			<yleinen>5</yleinen>
		</KT>
		<GE>
			<yleinen>5</yleinen>
		</GE>
      </perusopetus>
    </todistukset>
  </oppilas>
  <oppilas>
	<oppijanumero>123.21213.2121.1212</oppijanumero>
    <todistukset>
      <perusopetus>
        <valmistuminen>2001-01-01</valmistuminen>
        <eivalmistu>JÄÄ LUOKALLE</eivalmistu>
      </perusopetus>
    </todistukset>
  </oppilas>
</arvosanat>
